title,url,date,content
Microsoft has a new plan to prove what’s real and what’s AI online,https://www.technologyreview.com/2026/02/19/1133360/microsoft-has-a-new-plan-to-prove-whats-real-and-whats-ai-online/,"Thu, 19 Feb 2026 16:00:00 +0000","AI-enabled deception now permeates our online lives. There are the high-profile cases you may easily spot, like when White House officials recently shared a manipulated image of a protester in Minnesota and then mocked those asking about it. Other times, it slips quietly into social media feeds and racks up views, like the videos that Russian influence campaigns are currently spreading to discourage Ukrainians from enlisting. 

 It is into this mess that Microsoft has put forward a blueprint , shared with MIT Technology Review , for how to prove what’s real online. 

 An AI safety research team at the company recently evaluated how methods for documenting digital manipulation are faring against today’s most worrying AI developments, like interactive deepfakes and widely accessible hyperrealistic models. It then recommended technical standards that can be adopted by AI companies and social media platforms.

 To understand the gold standard that Microsoft is pushing, imagine you have a Rembrandt painting and you are trying to document its authenticity. You might describe its provenance with a detailed manifest of where the painting came from and all the times it changed hands. You might apply a watermark that would be invisible to humans but readable by a machine. And you could digitally scan the painting and generate a mathematical signature, like a fingerprint , based on the brush strokes. If you showed the piece at a museum, a skeptical visitor could then examine these proofs to verify that it’s an original.

 All of these methods are already being used to varying degrees in the effort to vet content online. Microsoft evaluated 60 different combinations of them, modeling how each setup would hold up under different failure scenarios—from metadata being stripped to content being slightly altered or deliberately manipulated. The team then mapped which combinations produce sound results that platforms can confidently show to people online, and which ones are so unreliable that they may cause more confusion than clarification. 

 The company’s chief scientific officer, Eric Horvitz, says the work was prompted by legislation—like California’s AI Transparency Act, which will take effect in August—and the speed at which AI has developed to combine video and voice with striking fidelity.

 “You might call this self-regulation,” Horvitz told MIT Technology Review . But it’s clear he sees pursuing the work as boosting Microsoft’s image: “We’re also trying to be a selected, desired provider to people who want to know what’s going on in the world.”

 Nevertheless, Horvitz declined to commit to Microsoft using its own recommendation across its platforms. The company sits at the center of a giant AI content ecosystem: It runs Copilot, which can generate images and text; it operates Azure, the cloud service through which customers can access OpenAI and other major AI models; it owns LinkedIn, one of the world’s largest professional platforms; and it holds a significant stake in OpenAI. But when asked about in-house implementation, Horvitz said in a statement, “Product groups and leaders across the company were involved in this study to inform product road maps and infrastructure, and our engineering teams are taking action on the report’s findings.”

 It’s important to note that there are inherent limits to these tools; just as they would not tell you what your Rembrandt means , they are not built to determine if content is accurate or not. They only reveal if it has been manipulated. It’s a point that Horvitz says he has to make to lawmakers and others who are skeptical of Big Tech as an arbiter of fact.

 “It’s not about making any decisions about what’s true and not true,” he said. “It’s about coming up with labels that just tell folks where stuff came from.”

 Hany Farid, a professor at UC Berkeley who specializes in digital forensics but wasn’t involved in the Microsoft research, says that if the industry adopted the company’s blueprint, it would be meaningfully more difficult to deceive the public with manipulated content. Sophisticated individuals or governments can work to bypass such tools, he says, but the new standard could eliminate a significant portion of misleading material.

 “I don’t think it solves the problem, but I think it takes a nice big chunk out of it,” he says.

 Still, there are reasons to see Microsoft’s approach as an example of somewhat naïve techno-optimism. There is growing evidence that people are swayed by AI-generated content even when they know that it is false. And in a recent study of pro-Russian AI-generated videos about the war in Ukraine, comments pointing out that the videos were made with AI received far less engagement than comments treating them as genuine. 

 “Are there people who, no matter what you tell them, are going to believe what they believe?” Farid asks. “Yes.” But, he adds, “there are a vast majority of Americans and citizens around the world who I do think want to know the truth.”

 That desire has not exactly led to urgent action from tech companies. Google started adding a watermark to content generated by its AI tools in 2023, which Farid says has been helpful in his investigations. Some platforms use C2PA , a provenance standard Microsoft helped launch in 2021. But the full suite of changes that Microsoft suggests, powerful as they are, might remain only suggestions if they threaten the business models of AI companies or social media platforms.

 “If the Mark Zuckerbergs and the Elon Musks of the world think that putting ‘AI generated’ labels on something will reduce engagement, then of course they’re incentivized not to do it,” Farid says. Platforms like Meta and Google have already said they’d include labels for AI-generated content, but an audit conducted by Indicator last year found that only 30% of its test posts on Instagram, LinkedIn, Pinterest, TikTok, and YouTube were correctly labeled as AI-generated.

 More forceful moves toward content verification might come from the many pieces of AI regulation pending around the world. The European Union’s AI Act, as well as proposed rules in India and elsewhere, would all compel AI companies to require some form of disclosure that a piece of content was generated with AI. 

 One priority from Microsoft is, unsurprisingly, to play a role in shaping these rules. The company waged a lobbying effort during the drafting of California’s AI Transparency Act, which Horvitz said made the legislation’s requirements on how tech companies must disclose AI-generated content “a bit more realistic.”

 But another is a very real concern about what could happen if the rollout of such content-verification technology is done poorly. Lawmakers are demanding tools that can verify what’s real, but the tools are fragile. If labeling systems are rushed out, inconsistently applied, or frequently wrong, people could come to distrust them altogether, and the entire effort would backfire. That’s why the researchers argue that it may be better in some cases to show nothing at all than a verdict that could be wrong.

 Inadequate tools could also create new avenues for what the researchers call sociotechnical attacks. Imagine that someone takes a real image of a fraught political event and uses an AI tool to change only an inconsequential share of pixels in the image. When it spreads online, it could be misleadingly classified by platforms as AI-manipulated. But combining provenance and watermark tools would mean platforms could clarify that the content was only partially AI generated, and point out where the changes were made.

 California’s AI Transparency Act will be the first major test of these tools in the US, but enforcement could be challenged by President Trump’s executive order from late last year seeking to curtail state AI regulations that are “burdensome” to the industry. The administration has also generally taken a posture against efforts to curb disinformation, and last year, via DOGE, it canceled grants related to misinformation. And, of course, official government channels in the Trump administration have shared content manipulated with AI ( MIT Technology Review reported that the Department of Homeland Security, for example, uses video generators from Google and Adobe to make content it shares with the public).

 I asked Horvitz whether fake content from this source worries him as much as that coming from the rest of social media. He initially declined to comment, but then he said, “Governments have not been outside the sectors that have been behind various kinds of manipulative disinformation, and this is worldwide.”"
Google DeepMind wants to know if chatbots are just virtue signaling,https://www.technologyreview.com/2026/02/18/1133299/google-deepmind-wants-to-know-if-chatbots-are-just-virtue-signaling/,"Wed, 18 Feb 2026 16:00:22 +0000","Moral scrutiny of AI chatbots
Google DeepMind researchers are calling for rigorous evaluation of large language models' moral reasoning capabilities. They want to distinguish between genuine ethical understanding and mere performance.

 Unreliable moral responses
Studies reveal LLMs can dramatically change moral stances based on minor formatting changes or user disagreement. This suggests their ethical responses may be superficial rather than deeply reasoned.

 Proposed research techniques
Researchers suggest developing tests that push models to maintain consistent moral positions across different scenarios. Techniques like chain-of-thought monitoring and mechanistic interpretability could help understand AI's moral decision-making process.

 Cultural complexity of ethics
The team acknowledges the challenge of developing AI with moral competence across diverse global belief systems. They propose potential solutions like creating models that can produce multiple acceptable answers or switch between different moral frameworks."" data-chronoton-post-id=""1133299"" data-chronoton-expand-collapse=""1"" data-chronoton-analytics-enabled=""1"">

 Google DeepMind is calling for the moral behavior of large language models—such as what they do when called on to act as companions, therapists, medical advisors, and so on—to be scrutinized with the same kind of rigor as their ability to code or do math .

 As LLMs improve, people are asking them to play more and more sensitive roles in their lives. Agents are starting to take actions on people’s behalf. LLMs may be able to influence human decision-making . And yet nobody knows how trustworthy this technology really is at such tasks.

 With coding and math, you have clear-cut, correct answers that you can check, William Isaac, a research scientist at Google DeepMind, told me when I met him and Julia Haas, a fellow research scientist at the firm, for an exclusive preview of their work, which is published in Nature today. That’s not the case for moral questions, which typically have a range of acceptable answers: “Morality is an important capability but hard to evaluate,” says Isaac.

 “In the moral domain, there’s no right and wrong,” adds Haas. “But it’s not by any means a free-for-all. There are better answers and there are worse answers.”

 The researchers have identified several key challenges and suggested ways to address them. But it is more a wish list than a set of ready-made solutions. “They do a nice job of bringing together different perspectives,” says Vera Demberg, who studies LLMs at Saarland University in Germany.

 Better than “The Ethicist”

 A number of studies have shown that LLMs can show remarkable moral competence. One study published last year found that people in the US scored ethical advice from OpenAI’s GPT-4o as being more moral, trustworthy, thoughtful, and correct than advice given by the (human) writer of “The Ethicist,” a popular New York Times advice column.  

 The problem is that it is hard to unpick whether such behaviors are a performance—mimicking a memorized response, say—or evidence that there is in fact some kind of moral reasoning taking place inside the model. In other words, is it virtue or virtue signaling?

 This question matters because multiple studies also show just how untrustworthy LLMs can be. For a start, models can be too eager to please. They have been found to flip their answer to a moral question and say the exact opposite when a person disagrees or pushes back on their first response. Worse, the answers an LLM gives to a question can change in response to how it is presented or formatted. For example, researchers have found that models quizzed about political values can give different—sometimes opposite—answers depending on whether the questions offer multiple-choice answers or instruct the model to respond in its own words.

 In an even more striking case, Demberg and her colleagues presented several LLMs, including versions of Meta’s Llama 3 and Mistral, with a series of moral dilemmas and asked them to pick which of two options was the better outcome. The researchers found that the models often reversed their choice when the labels for those two options were changed from “Case 1” and “Case 2” to “(A)” and “(B).”

 They also showed that models changed their answers in response to other tiny formatting tweaks, including swapping the order of the options and ending the question with a colon instead of a question mark.

 In short, the appearance of moral behavior in LLMs should not be taken at face value. Models must be probed to see how robust that moral behavior really is. “For people to trust the answers, you need to know how you got there,” says Haas.

 More rigorous tests

 What Haas, Isaac, and their colleagues at Google DeepMind propose is a new line of research to develop more rigorous techniques for evaluating moral competence in LLMs. This would include tests designed to push models to change their responses to moral questions. If a model flipped its moral position, it would show that it hadn’t engaged in robust moral reasoning. 

 Another type of test would present models with variations of common moral problems to check whether they produce a rote response or one that’s more nuanced and relevant to the actual problem that was posed. For example, asking a model to talk through the moral implications of a complex scenario in which a man donates sperm to his son so that his son can have a child of his own might produce concerns about the social impact of allowing a man to be both biological father and biological grandfather to a child. But it should not produce concerns about incest, even though the scenario has superficial parallels with that taboo.

 Haas also says that getting models to provide a trace of the steps they took to produce an answer would give some insight into whether that answer was a fluke or grounded in actual evidence. Techniques such as chain-of-thought monitoring , in which researchers listen in on a kind of internal monologue that some LLMs produce as they work, could help here too.

 Another approach researchers could use to determine why a model gave a particular answer is mechanistic interpretability , which can provide small glimpses inside a model as it carries out a task. Neither chain-of-thought monitoring nor mechanistic interpretability provides perfect snapshots of a model’s workings. But the Google DeepMind team believes that combining such techniques with a wide range of rigorous tests will go a long way to figuring out exactly how far to trust LLMs with certain critical or sensitive tasks.  

 Different values

 And yet there’s a wider problem too. Models from major companies such as Google DeepMind are used across the world by people with different values and belief systems. The answer to a simple question like “Should I order pork chops?” should differ depending on whether or not the person asking is vegetarian or Jewish, for example.

 There’s no solution to this challenge, Haas and Isaac admit. But they think that models may need to be designed either to produce a range of acceptable answers, aiming to please everyone, or to have a kind of switch that turns different moral codes on and off depending on the user.

 “It’s a complex world out there,” says Haas. “We will probably need some combination of those things, because even if you’re taking just one population, there’s going to be a range of views represented.”

 “It’s a fascinating paper,” says Danica Dillion at Ohio State University, who studies how large language models handle different belief systems and was not involved in the work. “Pluralism in AI is really important, and it’s one of the biggest limitations of LLMs and moral reasoning right now,” she says. “Even though they were trained on a ginormous amount of data, that data still leans heavily Western. When you probe LLMs, they do a lot better at representing Westerners’ morality than non-Westerners’.”

 But it is not yet clear how we can build models that are guaranteed to have moral competence across global cultures, says Demberg. “There are these two independent questions. One is: How should it work? And, secondly, how can it technically be achieved? And I think that both of those questions are pretty open at the moment.”

 For Isaac, that makes morality a new frontier for LLMs. “I think this is equally as fascinating as math and code in terms of what it means for AI progress,” he says. “You know, advancing moral competency could also mean that we’re going to see better AI systems overall that actually align with society.”"
